"";"DI";"LCS";"SR";"TI_TM";"AU";"DE";"ID";"C1";"CR";"AB";"PA";"affiliations";"AR";"EM";"book.author";"BO";"da";"GA";"eissn";"esi.highly.cited.paper";"esi.hot.paper";"earlyaccessdate";"BE";"FU";"FX";"BN";"SN";"JI";"SO";"LA";"month";"note";"NR";"PN";"oa";"orcid.numbers";"organization";"PP";"PU";"SC";"researcherid.numbers";"SE";"TC";"TI";"DT";"UT";"usage.count.last.180.days";"U2";"VL";"web.of.science.categories.";"web.of.science.index";"PY";"RP";"DB";"J9";"AU_UN";"AU1_UN";"AU_UN_NR";"SR_FULL";"coden";"pmid";"publication_stage";"url";"PM";"AF";"PD";"PMCID";"NIHMS.ID";"BVS_ID";"Country";"URL";"IS";"Accession.number";"scielo_ID";"tolower(TI)";"tolower(SR)";"tolower(DI)";"Clusters"
"1";"10.1017/S1742058X13000210";14;"ROBERTS D, 2013, DU BOIS REV";"MOVEMENT INTERSECTIONALITY;INTERSECTIONALITY ITHE;RACEI IGENDERI;IGENDERI IDISABILITYI;IDISABILITYI IAND;IAND GENETIC;GENETIC TECHNOLOGIESI";"ROBERTS D;JESUDASON S";"INTERSECTIONALITY; SOCIAL MOVEMENTS; RACE; GENDER; DISABILITY; GENETIC; TESTING";NA;"ROBERTS, D (CORRESPONDING AUTHOR), UNIV PENN, SCH LAW, 3501 SANSOM ST, PHILADELPHIA, PA 19104 USA.; ROBERTS, DOROTHY, UNIV PENN, SCH LAW, DEPT AFRICANA STUDIES, DEPT SOCIOL, PHILADELPHIA, PA 19104 USA.; JESUDASON, SUJATHA, UNIV CALIF SAN FRANCISCO, ADV NEW STAND REPROD HLTH, SAN FRANCISCO, CA 94143 USA.";"ANONYMOUS, DISABILITY SOC; ANONYMOUS, PRENATAL TESTING DIS; ANONYMOUS, BRIDG DIV DIS RIGHTS; ANONYMOUS, PRENATAL TESTING DIS; ANONYMOUS, R EDW VIRG IR UNN OP; ANONYMOUS, REPR JUST AN GEN TEC; ANONYMOUS, BRIT PROGR LIB VIRG; ANONYMOUS, 2002, THIS BRIDGE WE CALL; BEAMISH TD, 2009, SOC PROBL, V56, P647, DOI 10.1525/SP.2009.56.4.647; BROWN WENDY., 1997, DIFFERENCES, V9, P79; CANAAN ANDREA., 1983, THIS BRIDGE CALLED M, P232; COLE ER, 2008, SEX ROLES, V59, P443, DOI 10.1007/S11199-008-9419-1; CRENSHAW KIMBERLE., 1989, UNIV CHICAGO LEG FOR, V1, P139; DAVIS K, 2008, FEM THEOR, V9, P67, DOI 10.1177/1464700108086364; DHAMOON RK, 2011, POLIT RES QUART, V64, P230, DOI 10.1177/1065912910379227; DILL BT, 1983, FEMINIST STUD, V9, P131, DOI 10.2307/3177687; GARLAND-THOMSON R, 2017, DISABILITY STUDIES READER, 5TH EDITION, P360; GREEN J, 2011, SAMUEL COLERIDGE-TAYLOR, A MUSICAL LIFE, P221; GREENWOOD RM, 2008, PSYCHOL WOMEN QUART, V32, P36, DOI 10.1111/J.1471-6402.2007.00405.X; GUTIERREZ ELENA., 2008, FERTILE MATTERS POLI; HILL-COLLINS P., 2000, BLACK FEMINIST THOUG, V2ND; JESUDASON SA, 2009, SIGNS, V34, P901, DOI 10.1086/597129; KEATING A, 2009, INTERSECTIONAL APPROACH: TRANSFORMING THE ACADEMY THROUGH RACE, CLASS, AND GENDER, P81; MCCALL L, 2005, SIGNS, V30, P1771, DOI 10.1086/426800; MORALES ROSARIO., 1983, THIS BRIDGE CALLED M, V2ND, P91; NELSON JENNIFER., 2003, WOMEN COLOR REPROD R; PARENS E, 1999, HASTINGS CENT REP, V29, PS1, DOI 10.2307/3527746; POKEMPNER J., 2001, OHIO STATE LAW J, V62, P425; ROBERTS D., 2011, FATAL INVENTION SCI; ROBERTS DE, 2004, J HIST SEXUALITY, V13, P535, DOI 10.1353/SEX.2005.0033; ROBERTS DOROTHY, 1997, KILLING THE BLACK BODY: RACE, REPRODUCTION, AND THE MEANING OF LIBERTY; ROBERTS DE, 2009, SIGNS, V34, P783, DOI 10.1086/597132; ROBERTS DOROTHYE., 2005, EMORY LAW J, V54, P1343; RUSSO A, 2009, INTERSECTIONAL APPROACH: TRANSFORMING THE ACADEMY THROUGH RACE, CLASS, AND GENDER, P309; SILLIMAN J., 2004, UNDIVIDED RIGHTS: WOMEN OF COLOR ORGANIZE FOR REPRODUCTIVE JUSTICE; SMITH P., 2004, DISABILITY STUDIES QUARTERLY, V24, P1, DOI DOI 10.18061/DSQ.V24I2.491, 10.18061/DSQ.V24I2.491; WENDELL SUSAN., 1996, THE REJECTED BODY: FEMINIST PHILOSOPHICAL REFLECTIONS ON DISABILITY; YUVAL-DAVIS N., 2011, FRAMING INTERSECTIONALITY: DEBATES ON A MULTI-FACETED CONCEPT IN GENDER STUDIES, P155";"INTERSECTIONAL ANALYSIS NEED NOT FOCUS SOLELY ON DIFFERENCES WITHIN OR BETWEEN IDENTITY-BASED GROUPS. USING INTERSECTIONALITY FOR CROSS MOVEMENT MOBILIZATION REVEALS THAT, CONTRARY TO CRITICISM FOR BEING DIVISIVE, ATTENTION TO INTERSECTING IDENTITIES HAS THE POTENTIAL TO CREATE SOLIDARITY AND COHESION. IN THIS ARTICLE, WE ELABORATE THIS ARGUMENT WITH A CASE STUDY OF THE INTERSECTION OF RACE, GENDER, AND DISABILITY IN GENETIC TECHNOLOGIES AS WELL AS IN ORGANIZING TO PROMOTE A SOCIAL JUSTICE APPROACH TO THE USE OF THESE TECHNOLOGIES. WE SHOW HOW ORGANIZING BASED ON AN INTERSECTIONAL ANALYSIS CAN HELP FORGE ALLIANCES BETWEEN REPRODUCTIVE JUSTICE, RACIAL JUSTICE, WOMEN'S RIGHTS, AND DISABILITY RIGHTS ACTIVISTS TO DEVELOP STRATEGIES TO ADDRESS REPRODUCTIVE GENETIC TECHNOLOGIES. WE USE THE WORK OF GENERATIONS AHEAD TO ILLUMINATE HOW INTERSECTIONALITY APPLIED AT THE MOVEMENT-BUILDING LEVEL CAN IDENTIFY GENUINE COMMON GROUND, CREATE AUTHENTIC ALLIANCES, AND MORE EFFECTIVELY ADVOCATE FOR SHARED POLICY PRIORITIES.";"EDINBURGH BLDG, SHAFTESBURY RD, CB2 8RU CAMBRIDGE, ENGLAND";"UNIVERSITY OF PENNSYLVANIA; UNIVERSITY OF CALIFORNIA SYSTEM; UNIVERSITY OF CALIFORNIA SAN FRANCISCO";NA;"DOROTHYROBERTS@LAW.UPENN.EDU";NA;NA;"2024-11-12";"298ZL";"1742-0598";NA;NA;NA;NA;NA;NA;NA;"1742-058X";"DU BOIS REV.";"DU BOIS REVIEW-SOCIAL SCIENCE RESEARCH ON RACE";"ENGLISH";NA;NA;"38";"2";NA;NA;NA;"313-328";"CAMBRIDGE UNIV PRESS";"ETHNIC STUDIES; SOCIOLOGY";NA;NA;101;"MOVEMENT INTERSECTIONALITY <I>THE CASE OF RACE</I>, <I>GENDER</I>, <I>DISABILITY</I>, <I>AND GENETIC TECHNOLOGIES</I>";"ARTICLE";"WOS000330363600002";"2";"24";"10";"ETHNIC STUDIES; SOCIOLOGY";"SOCIAL SCIENCE CITATION INDEX (SSCI)";2013;"ROBERTS, D (CORRESPONDING AUTHOR), UNIV PENN, SCH LAW, 3501 SANSOM ST, PHILADELPHIA, PA 19104 USA";"ISI";"DU BOIS REV";"UNIV PENN;UNIV PENN;UNIV CALIF SAN FRANCISCO";"UNIV PENN";NA;"ROBERTS D, 2013, DU BOIS REV";NA;NA;NA;NA;NA;NA;NA;NA;NA;NA;NA;NA;NA;NA;NA;"movement intersectionality <i>the case of race</i>, <i>gender</i>, <i>disability</i>, <i>and genetic technologies</i>";"roberts d, 2013, du bois rev";"10.1017/s1742058x13000210";"4"
"2";"10.1002/symb.349";13;"MANN ES, 2018, SYMB INTERACT";"VISUAL RHETORICS;LONG-ACTING REVERSIBLE;REVERSIBLE CONTRACEPTION;CONTRACEPTION PROMOTION";"MANN ES;GRZANKA PR";"REPRODUCTIVE JUSTICE; NEOLIBERALISM; INTERSECTIONALITY; CRITICAL; DISCOURSE ANALYSIS; VISUAL CULTURE";"UNINTENDED PREGNANCY; REPRODUCTIVE JUSTICE; UNITED-STATES; WOMEN; LARC;; AMBIVALENCE; INTENTIONS; DISCOURSES";"GRZANKA, PR (CORRESPONDING AUTHOR), UNIV TENNESSEE, DEPT PSYCHOL, 1404 CIRCLE DR, KNOXVILLE, TN 37996 USA.; UNIV SOUTH CAROLINA, HLTH PROMOT EDUC \& BEHAV, COLUMBIA, SC 29208 USA.; UNIV SOUTH CAROLINA, WOMENS \& GENDER STUDIES PROGRAM, COLUMBIA, SC 29208 USA.; GRZANKA, PATRICK R., UNIV TENNESSEE, PSYCHOL, KNOXVILLE, TN USA.; GRZANKA, PATRICK R., UNIV TENNESSEE, INTERDISCIPLINARY PROGRAM WOMEN GENDER \& SEXUAL, KNOXVILLE, TN USA.";"ANONYMOUS, 2005, SITUATIONAL ANALYSIS: GROUNDED THEORY AFTER THE POSTMODERN TURN; ANONYMOUS, 2015, THE CUT; ANONYMOUS, 1984, DISTINCTION; BAY-CHENG L.Y., 2015, JOURNAL OF SOCIAL AND POLITICAL PSYCHOLOGY, V3, P71, DOI DOI 10.5964/JSPP.V3I1.366; BAY-CHENG LY, 2008, J SEX RES, V45, P386, DOI 10.1080/00224490802398381; BAY-CHENG LY, 2015, SEX ROLES, V73, P279, DOI 10.1007/S11199-015-0452-6; BUTLER J, 1993, BODIES THAT MATTER: ON THE DISCURSIVE LIMITS OF ``SEX, DOI DOI 10.4324/9780203828274; CHARMAZ K., 2014, CONSTRUCTING GROUNDE; CLARKE ADELEE., 1992, RIGHT TOOLS JOB WORK; CLARKE AE, 2000, WOM HEALTH, P37; CORBIN J., 2015, BASICS QUALITATIVE R; DEHLENDORF C, 2014, PERSPECT SEX REPRO H, V46, P233, DOI 10.1363/46E2114; DUGGAN L., 2003, TWILIGHT EQUALITY; ELLIOTT S, 2014, SEX RES SOC POLICY, V11, P211, DOI 10.1007/S13178-014-0158-5; ELLIOTT S, 2010, SYMB INTERACT, V33, P191, DOI 10.1525/SI.2010.33.2.191; FAIRCHILD AL, 2015, HEALTH AFFAIR, V34, P844, DOI 10.1377/HLTHAFF.2014.1236; FIELDS JESSICA., 2008, RISKY LESSONS SEX ED; FINE M., 2006, HARVARD EDUC REV, V76, P297, DOI DOI 10.17763/HAER.76.3.W5042G23122N6703; FINER LB, 2016, NEW ENGL J MED, V374, P843, DOI 10.1056/NEJMSA1506575; FISHMAN JENNIFER., 2017, THE HANDBOOK OF SCIENCE AND TECHNOLOGY STUDIES, VFOURTH, P379; FISHMAN JR, 2001, WOMEN THER, V24, P179, DOI 10.1300/J015V24N01\_20; FOUCAULT M, 2008, MICHEL FOUCAULT-LECT, P1, DOI 10.1057/9780230594180; GOFFMAN ERVING., 1979, GENDER ADVERTISEMENTS, V2ND ED.; GOMEZ AM, 2018, CRIT PUBLIC HEALTH, V28, P190, DOI 10.1080/09581596.2017.1343935; GOMEZ AM, 2017, MATERN CHILD HLTH J, V21, P1753, DOI 10.1007/S10995-017-2297-9; GOMEZ AM, 2014, PERSPECT SEX REPRO H, V46, P171, DOI 10.1363/46E1614; GRZANKA PR, 2017, COUNS PSYCHOL, V45, P326, DOI 10.1177/0011000017699871; GRZANKA PR, 2016, SEX RES SOC POLICY, V13, P297, DOI 10.1007/S13178-016-0255-8; GRZANKA PR, 2014, SEXUALITIES, V17, P369, DOI 10.1177/1363460713516785; GRZANKA PR, 2012, SYMB INTERACT, V35, P368, DOI 10.1002/SYMB.24, 10.1002/SYMB.24; GUBRIUM AC, 2016, AM J PUBLIC HEALTH, V106, P18, DOI 10.2105/AJPH.2015.302900; GUTIERREZ ELENA., 2008, FERTILE MATTERS POLI; HALL S, 1980, MEDIA CULT SOC, V2, P57, DOI 10.1177/016344378000200106; HARRIS A., 2004, FUTURE GIRL YOUNG WO; HAYS SHARON., 2003, FLAT BROKE WITH CHILDREN: WOMEN IN THE AGE OF WELFARE REFORM; HIGGINS JA, 2017, PERSPECT SEX REPRO H, V49, P149, DOI 10.1363/PSRH.12025; HIGGINS JA, 2015, PERSPECT SEX REPRO H, V47, P114, DOI 10.1363/47E4515; HIGGINS JA, 2014, CONTRACEPTION, V89, P237, DOI 10.1016/J.CONTRACEPTION.2014.01.027; HILL C., 2012, CONSENSUAL QUALITATI; JOYCE KELLY., 2008, MAGNETIC APPEAL: MRI AND THE MYTH OF TRANSPARENCY; KELLY PETER., 2001, DISCOURSE-ABINGDON, V22, P23, DOI DOI 10.1080/01596300120039731, HTTPS://DOI.ORG/10.1080/01596300120039731, 10.1080/01596300120039731; KOST K., 2015, UNINTENDED PREGNANCY; LOSEKE D.R., 2003, THINKING SOCIAL PROB; LUKER KC, 1999, FAM PLANN PERSPECT, V31, P248, DOI 10.2307/2991574; LUKER KRISTIN., 2007, WHEN SEX GOES TO SCHOOL: WARRING VIEWS ON SEX--AND SEX EDUCATION-SINCE THE SIXTIES; MADDEN T, 2013, CONTRACEPTION, V88, P243, DOI 10.1016/J.CONTRACEPTION.2012.07.015; MALLON MOLLY., 2016, GLAMOUR; MAMO L, 2014, SOC SCI MED, V101, P155, DOI 10.1016/J.SOCSCIMED.2013.11.028; MAMO LAURA., 2001, BODY SOC, V7, P13, DOI DOI 10.1177/1357034X01007004002; MANN ES, 2016, SEX RES SOC POLICY, V13, P330, DOI 10.1007/S13178-016-0237-X; MANN ES, 2013, GENDER SOC, V27, P681, DOI 10.1177/0891243213493961; MINNIS AM, 2014, PERSPECT SEX REPRO H, V46, P223, DOI 10.1363/46E1414; MONEA E, 2011, PERSPECT SEX REPRO H, V43, P88, DOI 10.1363/4308811; MORRISON CHLOE, 2014, NOOGA 1020; ORR JACKIE., 2006, PANIC DIARIES: A GENEALOGY OF PANIC DISORDER; PEREZ MIRIAM, 2013, BACKLASH NYC TEEN PR; REICH JA, 2016, SEX RES SOC POLICY, V13, P341, DOI 10.1007/S13178-016-0227-Z; ROBERTS DOROTHY, 1997, KILLING THE BLACK BODY: RACE, REPRODUCTION, AND THE MEANING OF LIBERTY; ROBERTS L, 2016, AM J PUBLIC HEALTH, V106, PE13, DOI 10.2105/AJPH.2016.303206; SANTELLI J, 2003, PERSPECT SEX REPRO H, V35, P94, DOI 10.1363/3509403; SANTELLI JS, 2009, STUD FAMILY PLANN, V40, P87, DOI 10.1111/J.1728-4465.2009.00192.X; SCHRAM SF, 2010, CITIZENSHIP STUD, V14, P739, DOI 10.1080/13621025.2010.522363; SECURA GM, 2010, AM J OBSTET GYNECOL, V203, DOI 10.1016/J.AJOG.2010.04.017; SONFIELD A., 2015, PUBLIC COSTS FROM UNINTENDED PREGNANCIES AND THE ROLE OF PUBLIC INSURANCE PROGRAMS IN PAYING FOR PREGNANCY-RELATED CARE: NATIONAL AND STATE ESTIMATES FOR 2010; STEVENS LM, 2015, SOC SCI MED, V139, P44, DOI 10.1016/J.SOCSCIMED.2015.06.027; TAKESHITA C, 2010, SCI CULT-UK, V19, P37, DOI 10.1080/09505430903558021; TAKESHITA CHIKAKO, 2011, GLOBAL BIOPOLITICS I; TRUSSELL J, 2013, CONTRACEPTION, V87, P154, DOI 10.1016/J.CONTRACEPTION.2012.07.016; TRUSSELL JAMES, 1999, FAMILY PLANNING PERS, V31, P256; WATKINS ES, 2010, J WOMENS HIST, V22, P88; WISE A, 2017, WOMEN HEALTH ISS, V27, P5, DOI 10.1016/J.WHI.2016.10.006; YOO SH, 2014, BIODEMOGR SOC BIOL, V60, P49, DOI 10.1080/19485565.2014.905193";"THIS MANUSCRIPT REPORTS THE FINDINGS OF A CRITICAL VISUAL DISCOURSE ANALYSIS OF LONG-ACTING REVERSIBLE CONTRACEPTION (LARC) PROMOTION MATERIALS. THE AUTHORS ARGUE THAT THESE CONTEMPORARY LARC PROMOTION IMAGES PRODUCE A DISCOURSE THEY IDENTIFY AS AGENCY-WITHOUT-CHOICE, IN WHICH LARC DEVICES ARE FRAMED AS THE ONLY RESPONSIBLE CONTRACEPTIVE OPTION PRECISELY BECAUSE THEY ARE SO EMPOWERING. THE AUTHORS SITUATE LARC PROMOTION WITHIN ITS HISTORICAL AND TRANSNATIONAL TRAVELS AND SUGGEST THAT LARC PROMOTION BE UNDERSTOOD WITHIN THE CONTEXT OF TWENTY-FIRST CENTURY NEOLIBERALISM. FINALLY, THEY CONSIDER THE IMPLICATIONS OF AGENCY-WITHOUT-CHOICE IN TERMS OF ONGOING SCHOLAR-ACTIVISM FOR REPRODUCTIVE JUSTICE. A VIDEO ABSTRACT IS AVAILABLE AT .HTTPS://TINYURLCOM/YA83DXDO.";"111 RIVER ST, HOBOKEN 07030-5774, NJ USA";"UNIVERSITY OF SOUTH CAROLINA SYSTEM; UNIVERSITY OF SOUTH CAROLINA COLUMBIA; UNIVERSITY OF SOUTH CAROLINA SYSTEM; UNIVERSITY OF SOUTH CAROLINA COLUMBIA; UNIVERSITY OF TENNESSEE SYSTEM; UNIVERSITY OF TENNESSEE KNOXVILLE; UNIVERSITY OF TENNESSEE SYSTEM; UNIVERSITY OF TENNESSEE KNOXVILLE";NA;"PATRICK.GRZANKA@UTK.EDU";NA;NA;"2024-11-12";"GP5SF";"1533-8665";NA;NA;NA;NA;NA;NA;NA;"0195-6086";"SYMB. INTERACT.";"SYMBOLIC INTERACTION";"ENGLISH";"AUG";NA;"72";"3";"BRONZE";"MANN, EMILY S./0000-0002-6246-2441 GRZANKA, PATRICK/0000-0002-7364-9965";NA;"334-356";"WILEY";"SOCIOLOGY";"MANN, EMILY S./IUO-5394-2023 ";NA;39;"AGENCY-WITHOUT-CHOICE: THE VISUAL RHETORICS OF LONG-ACTING REVERSIBLE CONTRACEPTION PROMOTION";"ARTICLE";"WOS000440932900003";"0";"11";"41";"SOCIOLOGY";"SOCIAL SCIENCE CITATION INDEX (SSCI)";2018;"GRZANKA, PR (CORRESPONDING AUTHOR), UNIV TENNESSEE, DEPT PSYCHOL, 1404 CIRCLE DR, KNOXVILLE, TN 37996 USA";"ISI";"SYMB INTERACT";"UNIV TENNESSEE;UNIV SOUTH CAROLINA;UNIV SOUTH CAROLINA;UNIV TENNESSEE;UNIV TENNESSEE";"UNIV TENNESSEE";NA;"MANN ES, 2018, SYMB INTERACT";NA;NA;NA;NA;NA;NA;NA;NA;NA;NA;NA;NA;NA;NA;NA;"agency-without-choice: the visual rhetorics of long-acting reversible contraception promotion";"mann es, 2018, symb interact";"10.1002/symb.349";"1, 4"
"3";"10.1111/josi.12363";11;"GRZANKA PR, 2020, J SOC ISSUES";"REPRODUCTIVE ANXIETY;CONDITIONAL AGENCY;EMERGING ADULTS;ADULTS PERCEPTION;LONG-ACTING REVERSIBLE;REVERSIBLE CONTRACEPTION";"GRZANKA PR;SCHUCH E";NA;"COMMUNITY-HEALTH CENTERS; UNINTENDED PREGNANCY; UNITED-STATES;; COUNSELING PSYCHOLOGY; STRUCTURAL-ANALYSIS; NO-COST; JUSTICE; WOMEN;; LARC; SEXUALITY";"GRZANKA, PR (CORRESPONDING AUTHOR), UNIV TENNESSEE, DEPT PSYCHOL, 1404 CIRCLE DR, KNOXVILLE, TN 37996 USA.; GRZANKA, PATRICK R.; SCHUCH, ELENA, UNIV TENNESSEE, DEPT PSYCHOL, 1404 CIRCLE DR, KNOXVILLE, TN 37996 USA.";"AKERS AY, 2010, J WOMENS HEALTH, V19, P1163, DOI 10.1089/JWH.2009.1735; ALMELING R, 2015, ANNU REV SOCIOL, V41, P423, DOI 10.1146/ANNUREV-SOC-073014-112258; AMICO JR, 2017, CONTRACEPTION, V96, P106, DOI 10.1016/J.CONTRACEPTION.2017.05.007; ANONYMOUS, 2009, OBSTET GYNECOL, V114, P1434, DOI 10.1097/AOG.0B013E3181C6F965; ANONYMOUS, 2005, SITUATIONAL ANALYSIS: GROUNDED THEORY AFTER THE POSTMODERN TURN; BAY-CHENG L.Y., 2015, JOURNAL OF SOCIAL AND POLITICAL PSYCHOLOGY, V3, P71, DOI DOI 10.5964/JSPP.V3I1.366; BAY-CHENG LY, 2015, SEX ROLES, V73, P279, DOI 10.1007/S11199-015-0452-6; BECKER D, 2008, PERSPECT SEX REPRO H, V40, P202, DOI 10.1363/4020208; BETTACHE K, 2019, J SOC ISSUES, V75, P8, DOI 10.1111/JOSI.12308; BIRD CE, 2008, GENDER AND HEALTH: THE EFFECTS OF CONSTRAINED CHOICES AND SOCIAL POLICIES, P1, DOI 10.1017/CBO9780511807305; BIRGISSON NE, 2015, J WOMENS HEALTH, V24, P349, DOI 10.1089/JWH.2015.5191; BLUMENTHAL PD, 2011, HUM REPROD UPDATE, V17, P121, DOI 10.1093/HUMUPD/DMQ026; BRANDI K, 2018, CONTRACEPTION, V97, P329, DOI 10.1016/J.CONTRACEPTION.2017.12.009; BRANUM AMY M, 2015, NCHS DATA BRIEF, P1; BRIDGES K.M., 2011, REPRODUCING RACE; BURNS B, 2015, WOMEN HEALTH ISS, V25, P224, DOI 10.1016/J.WHI.2014.12.006; CHENG SCJ, 2015, JNP-J NURSE PRACT, V11, P417, DOI 10.1016/J.NURPRA.2014.10.029; CLARKE AE, 2000, WOM HEALTH, P37; COLE ER, 2009, AM PSYCHOL, V64, P170, DOI 10.1037/A0014564; CORBIN J., 2015, BASICS QUALITATIVE R; CRENSHAW K, 1993, STANFORD LAW REVIEW VOL 43, NO 6, JULY 1991, P1241; CRENSHAW K., 1989, FEMINIST LEGAL THEORIES, V1989, P8; DEHLENDORF C, 2017, CONTRACEPTION, V95, P452, DOI 10.1016/J.CONTRACEPTION.2016.12.010; DEHLENDORF C, 2014, PERSPECT SEX REPRO H, V46, P233, DOI 10.1363/46E2114; DEHLENDORF C, 2014, CLIN OBSTET GYNECOL, V57, P659, DOI 10.1097/GRF.0000000000000059; DEHLENDORF C, 2013, CONTRACEPTION, V88, P250, DOI 10.1016/J.CONTRACEPTION.2012.10.012; DEHLENDORF C, 2010, AM J OBSTET GYNECOL, V203, DOI 10.1016/J.AJOG.2010.05.009; DOWNING RA, 2007, AM J PUBLIC HEALTH, V97, P1803, DOI 10.2105/AJPH.2006.092585; DUGGAN L., 2003, TWILIGHT EQUALITY; EATON A, 2020, J SOCIAL ISSUES; ELLIOTT S, 2014, SEX RES SOC POLICY, V11, P211, DOI 10.1007/S13178-014-0158-5; ELLIOTT S, 2010, SYMB INTERACT, V33, P191, DOI 10.1525/SI.2010.33.2.191; FASSINGER RE, 2005, J COUNS PSYCHOL, V52, P156, DOI 10.1037/0022-0167.52.2.156; FEAGIN J.R., 2013, WHITE RACIAL FRAME C, V2ND, DOI 10.4324/9780203076828, DOI 10.4324/9780203076828; FIELDS J, 2012, SOCIOL COMPASS, V6, P1, DOI 10.1111/J.1751-9020.2011.00436.X; FINE M, 1988, HARVARD EDUC REV, V58, P29, DOI 10.17763/HAER.58.1.U0468K1V2N2N8242; FINE M., 2006, HARVARD EDUC REV, V76, P297, DOI DOI 10.17763/HAER.76.3.W5042G23122N6703; FINER LB, 2016, NEW ENGL J MED, V374, P843, DOI 10.1056/NEJMSA1506575; FOSTER DG, 2015, CONTRACEPTION, V92, P543, DOI 10.1016/J.CONTRACEPTION.2015.10.003; GARCÍA L, 2009, GENDER SOC, V23, P520, DOI 10.1177/0891243209339498; GINSBURG F, 1991, ANNU REV ANTHROPOL, V20, P311; GOMEZ AM, 2017, CONTRACEPTION, V96, P221, DOI 10.1016/J.CONTRACEPTION.2017.07.007; GOMEZ AM, 2018, CRIT PUBLIC HEALTH, V28, P190, DOI 10.1080/09581596.2017.1343935; GOMEZ AM, 2015, WOMEN HEALTH ISS, V25, P359, DOI 10.1016/J.WHI.2015.03.011; GOMEZ AM, 2014, PERSPECT SEX REPRO H, V46, P171, DOI 10.1363/46E1614; GRZANKA PR, 2017, COUNS PSYCHOL, V45, P326, DOI 10.1177/0011000017699871; GRZANKA PR, 2016, SEX RES SOC POLICY, V13, P297, DOI 10.1007/S13178-016-0255-8; GRZANKA PR, 2016, AM J BIOETHICS, V16, P27, DOI 10.1080/15265161.2016.1145289; GUBRIUM A., 2008, DIFFERENTAKES, V50, P1; GUBRIUM AC, 2016, AM J PUBLIC HEALTH, V106, P18, DOI 10.2105/AJPH.2015.302900; HANCOCK ANGE-MARIE., 2004, POLITICS DISGUST PUB; HARAWAY D, 1988, FEMINIST STUD, V14, P575, DOI 10.2307/3178066; HARPER CC, 2013, PREV MED, V57, P883, DOI 10.1016/J.YPMED.2013.10.005; HIGGINS JA, 2017, PERSPECT SEX REPRO H, V49, P149, DOI 10.1363/PSRH.12025; HIGGINS JA, 2016, AM J PUBLIC HEALTH, V106, P1932, DOI 10.2105/AJPH.2016.303393; HIGGINS JA, 2014, CONTRACEPTION, V89, P237, DOI 10.1016/J.CONTRACEPTION.2014.01.027; JANIAK E, 2018, PERSPECT SEX REPRO H, V50, P111, DOI 10.1363/PSRH.12071; JONES RK, 2016, CONTRACEPTION, V93, P551, DOI 10.1016/J.CONTRACEPTION.2016.02.005; KAVANAUGH ML, 2018, CONTRACEPTION, V97, P14, DOI 10.1016/J.CONTRACEPTION.2017.10.003; KAVANAUGH ML, 2015, OBSTET GYNECOL, V126, P917, DOI 10.1097/AOG.0000000000001094; LESSARD LN, 2012, PERSPECT SEX REPRO H, V44, P194, DOI 10.1363/4419412; LEVITT H.M., 2016, QUAL PSYCHOL, V4, P2, DOI DOI 10.1037/QUP0000082, HTTPS://DOI.ORG/10.1037/QUP0000082; LEWIS JA, 2016, COUNS PSYCHOL, V44, P758, DOI 10.1177/0011000016641193; LOPEZ IRIS., 2008, MATTERS OF CHOICE: PUERTO RICAN WOMEN'S STRUGGLE FOR REPRODUCTIVE FREEDOM; LUKER KRISTIN., 2008, SALSA DANCING INTO THE SOCIAL SCIENCES: RESEARCH IN AN AGE OF INFO-GLUT; LUNA Z, 2016, GENDER SOC, V30, P769, DOI 10.1177/0891243216649929; LUNA Z, 2013, ANNU REV LAW SOC SCI, V9, P327, DOI 10.1146/ANNUREV-LAWSOCSCI-102612-134037; MANN ES, 2019, CONTRACEPTION, V100, P165, DOI 10.1016/J.CONTRACEPTION.2019.04.007; MANN ES, 2018, SYMB INTERACT, V41, P334, DOI 10.1002/SYMB.349; MANN ES, 2016, SEX RES SOC POLICY, V13, P330, DOI 10.1007/S13178-016-0237-X; MANN ES, 2013, GENDER SOC, V27, P681, DOI 10.1177/0891243213493961; MCCLELLAND S.I., 2014, APA HANDBOOK OF SEXUALITY AND PSYCHOLOGY: VOL. 2. CONTEXTUAL APPROACHES, V2, P311, DOI DOI 10.1037/14194-010; MCCLELLAND SI, 2020, J SOC ISSUES, V76, P239, DOI 10.1111/JOSI.12367; MORADI B, 2017, J COUNS PSYCHOL, V64, P500, DOI 10.1037/COU0000203; MORSE J, 2012, PERSPECT SEX REPRO H, V44, P100, DOI 10.1363/4410012; MOSHER WD, 2016, HUM REPROD, V31, P1696, DOI 10.1093/HUMREP/DEW117; MOSHER WILLIAM D, 2012, NATL HEALTH STAT REPORT, P1; NEVILLE HA, 2013, AM PSYCHOL, V68, P455, DOI 10.1037/A0033282; NORTHRIDGE JL, 2015, AM J PUBLIC HEALTH, V105, P1284, DOI 10.2105/AJPH.2015.302701; PEIPERT JF, 2012, OBSTET GYNECOL, V120, P1291, DOI 10.1097/AOG.0B013E318273EB56, HTTP://10.1097/AOG.0B013E318273EB56; REEVES MF, 2016, AM J OBSTET GYNECOL, V215, DOI 10.1016/J.AJOG.2016.01.162; ROBERTS DOROTHY, 1997, KILLING THE BLACK BODY: RACE, REPRODUCTION, AND THE MEANING OF LIBERTY; ROBERTS L, 2016, AM J PUBLIC HEALTH, V106, PE13, DOI 10.2105/AJPH.2016.303206; ROCCA CH, 2016, AM J OBSTET GYNECOL, V214, DOI 10.1016/J.AJOG.2015.12.009; ROCCA CH, 2012, PERSPECT SEX REPRO H, V44, P150, DOI 10.1363/4415012; ROMERO D, 2009, WOMEN HEALTH ISS, V19, P355, DOI 10.1016/J.WHI.2009.08.004; ROSENBERG S, 2020, J SOCIOL, V56, P571, DOI 10.1177/1440783319896413; ROSS L. J., 2018, RADICAL REPROD JUSTI; ROSS LJ, 2017, SOULS, V19, P286, DOI 10.1080/10999949.2017.1389634; ROSS LORETTARICKIE SOLINGER., 2017, REPRODUCTIVE JUSTICE: AN INTRODUCTION; SECURA GM, 2014, NEW ENGL J MED, V371, P1316, DOI 10.1056/NEJMOA1400506; SECURA GM, 2010, AM J OBSTET GYNECOL, V203, DOI 10.1016/J.AJOG.2010.04.017; SOCIETY FOR ADOLESCENT HEALTH AND MEDICINE, 2017, J ADOLESC HEALTH, V60, P472, DOI 10.1016/J.JADOHEALTH.2017.01.010; STEPHENS M, 2012, CHAND PUBL SOC MEDIA, P117; STERN AM, 2005, AM J PUBLIC HEALTH, V95, P1128, DOI 10.2105/AJPH.2004.041608; STRASSER J, 2017, WOMEN HEALTH ISS, V27, P253, DOI 10.1016/J.WHI.2017.04.003; SUFRIN C, 2015, PERSPECT SEX REPRO H, V47, P213, DOI 10.1363/47E3115; SWEENEY MM, 2014, ANNU REV SOCIOL, V40, P539, DOI 10.1146/ANNUREV-SOC-071913-043342; TAKESHITA C, 2010, SCI CULT-UK, V19, P37, DOI 10.1080/09505430903558021; THOMPSON KMJ, 2018, AM J OBSTET GYNECOL, V218, DOI 10.1016/J.AJOG.2018.03.016; THOMPSON KMJ, 2016, AM J PUBLIC HEALTH, V106, P541, DOI 10.2105/AJPH.2015.303001; TRUSSELL J, 2013, CONTRACEPTION, V87, P154, DOI 10.1016/J.CONTRACEPTION.2012.07.016; WAGGONER MIRANDAR., 2017, THE ZERO TRIMESTER: PRE-PREGNANCY CARE AND THE POLITICS OF REPRODUCTIVE RISK; WEST C, 1987, GENDER SOC, V1, P125, DOI 10.1177/0891243287001002002; WISE A, 2017, WOMEN HEALTH ISS, V27, P5, DOI 10.1016/J.WHI.2016.10.006; WU JP, 2016, FAM MED, V48, P345; ZEAL C, 2018, BIORESEARCH OPEN ACC, V7, P25, DOI 10.1089/BIORES.2017.0037; ZUCKER AN, 2014, ANAL SOC ISS PUB POL, V14, P210, DOI 10.1111/ASAP.12059";"PUBLIC HEALTH OFFICIALS AND MAJOR HEALTH CARE ORGANIZATIONS IN THE UNITED STATES HAVE IDENTIFIED LONG-ACTING REVERSIBLE CONTRACEPTION (LARC) AS THE FIRST-LINE OPTION FOR PREVENTING UNINTENDED PREGNANCY. EXISTING RESEARCH ON LARC FOCUSES ON EFFICACY AND USAGE RATES, GENERALLY EFFACING WOMEN'S LIVED EXPERIENCES WITH THESE HISTORICALLY CONTROVERSIAL DEVICES. WE TAKE A CRITICAL, REPRODUCTIVE JUSTICE-INFORMED APPROACH TO LARC PROMOTION EFFORTS IN THIS QUALITATIVE, FOCUS GROUP STUDY. ACROSS SIX GROUPS OF UNDERGRADUATE WOMEN AGES 18-24 (N = 30, MAJORITY WHITE), WE EXPLORE HOW THE INDIVIDUALS TARGETED BY CONTEMPORARY LARC PROMOTION EFFORTS-EMERGING ADULT WOMEN WHO HAVE NEVER GIVEN BIRTH-NEGOTIATE (NOT) ACQUIRING THESE DEVICES. WE INTRODUCE REPRODUCTIVE ANXIETY AND CONDITIONAL AGENCY AS KEY TERMS THROUGH WHICH OUR PARTICIPANTS MADE MEANING OUT OF LARC. THOUGH PARTICIPANTS REFLECTED SOCIALLY NORMATIVE DISCOURSES OF EMPOWERMENT AND CHOICE, OUR FINDINGS SUGGEST THAT THESE RELATIVELY PRIVILEGED RESPONDENTS EXPERIENCED THEIR CHOICES TO USE OR NOT USE LARC IN NEOLIBERAL TERMS. SPECIFICALLY, WE SUGGEST THEIR RESPONSES AVERT ATTENTION FROM THE MULTIFARIOUS WAYS THAT WOMEN'S REPRODUCTIVE CAPACITIES ARE DIFFERENTIALLY DISCIPLINED BY HEGEMONIC NORMS. WE CONCLUDE BY SUGGESTING THAT SEXUAL AND REPRODUCTIVE HEALTH POLICY MUST FOREGROUND ISSUES OF STRUCTURAL INTERSECTIONALITY-RATHER THAN COST OR EFFICACY-SO THAT HEALTH PROMOTION EFFORTS DO NOT INADVERTENTLY EXACERBATE INEQUALITIES.";"111 RIVER ST, HOBOKEN 07030-5774, NJ USA";"UNIVERSITY OF TENNESSEE SYSTEM; UNIVERSITY OF TENNESSEE KNOXVILLE";NA;"PATRICK.GRZANKA@UTK.EDU";NA;NA;"2024-11-12";"MA8SF";"1540-4560";NA;NA;"DEC 2019";NA;"STUDENT/FACULTY RESEARCH GRANT FROM THE GRADUATE SCHOOL AT THE UNIVERSITY OF TENNESSEE";"THE AUTHORS CONTRIBUTED EQUALLY TO THIS MANUSCRIPT AND THEIR NAMES ARE LISTED ALPHABETICALLY. THIS MANUSCRIPT IS BASED ON ELENA SCHUCH'S MASTER'S THESIS UNDER THE DIRECTION OF PATRICK R. GRZANKA. THEIR WORK WAS SUPPORTED BY A STUDENT/FACULTY RESEARCH GRANT FROM THE GRADUATE SCHOOL AT THE UNIVERSITY OF TENNESSEE. WE THANK ANDY RENISON AND ARRY EIDAM FOR THEIR INVALUABLE ASSISTANCE WITH THE CODING PROCESS, AND JIONI LEWIS AND KIRSTEN GONZALEZ FOR THEIR HELPFUL FEEDBACK ON AN EARLIER DRAFT. FINALLY, WE THANK OUR PARTICIPANTS FOR SHARING THEIR TIME AND STORIES WITH US.";NA;"0022-4537";"J. SOC. ISSUES";"JOURNAL OF SOCIAL ISSUES";"ENGLISH";"JUN";NA;"108";"2";NA;NA;NA;"270-313";"WILEY";"SOCIAL ISSUES; PSYCHOLOGY";NA;NA;19;"REPRODUCTIVE ANXIETY AND CONDITIONAL AGENCY AT THE INTERSECTIONS OF PRIVILEGE: A FOCUS GROUP STUDY OF EMERGING ADULTS' PERCEPTION OF LONG-ACTING REVERSIBLE CONTRACEPTION";"ARTICLE";"WOS000503961700001";"0";"8";"76";"SOCIAL ISSUES; PSYCHOLOGY, SOCIAL";"SOCIAL SCIENCE CITATION INDEX (SSCI)";2020;"GRZANKA, PR (CORRESPONDING AUTHOR), UNIV TENNESSEE, DEPT PSYCHOL, 1404 CIRCLE DR, KNOXVILLE, TN 37996 USA";"ISI";"J SOC ISSUES";"UNIV TENNESSEE;UNIV TENNESSEE";"UNIV TENNESSEE";NA;"GRZANKA PR, 2020, J SOC ISSUES";NA;NA;NA;NA;NA;NA;NA;NA;NA;NA;NA;NA;NA;NA;NA;"reproductive anxiety and conditional agency at the intersections of privilege: a focus group study of emerging adults' perception of long-acting reversible contraception";"grzanka pr, 2020, j soc issues";"10.1111/josi.12363";"1, 4"
